#queryIndex	queryItem	stringId	preferredName	annotation
61	TCF12	9606.ENSP00000388940	TCF12	Transcription factor 12; Transcriptional regulator. Involved in the initiation of neuronal differentiation. Activates transcription by binding to the E box (5'-CANNTG-3').
62	MYOG	9606.ENSP00000241651	MYOG	Myogenin; Acts as a transcriptional activator that promotes transcription of muscle-specific target genes and plays a role in muscle differentiation, cell cycle exit and muscle atrophy. Essential for the development of functional embryonic skeletal fiber muscle differentiation. However is dispensable for postnatal skeletal muscle growth; phosphorylation by CAMK2G inhibits its transcriptional activity in respons to muscle activity. Required for the recruitment of the FACT complex to muscle-specific promoter regions, thus promoting gene expression initiation. During terminal myoblast dif [...] 
63	MYF6	9606.ENSP00000228641	MYF6	Myogenic factor 6; Involved in muscle differentiation (myogenic factor). Induces fibroblasts to differentiate into myoblasts. Probable sequence specific DNA-binding protein.
64	MYOD1	9606.ENSP00000250003	MYOD1	Myoblast determination protein 1; Acts as a transcriptional activator that promotes transcription of muscle-specific target genes and plays a role in muscle differentiation. Together with MYF5 and MYOG, co-occupies muscle-specific gene promoter core region during myogenesis. Induces fibroblasts to differentiate into myoblasts. Interacts with and is inhibited by the twist protein. This interaction probably involves the basic domains of both proteins (By similarity).
65	MYF5	9606.ENSP00000228644	MYF5	Myogenic factor 5; Transcriptional activator that promotes transcription of muscle-specific target genes and plays a role in muscle differentiation. Together with MYOG and MYOD1, co-occupies muscle- specific gene promoter core region during myogenesis. Induces fibroblasts to differentiate into myoblasts. Probable sequence specific DNA-binding protein.
66	FIGLA	9606.ENSP00000333097	FIGLA	Factor in the germline alpha; Germline specific transcription factor implicated in postnatal oocyte-specific gene expression. Plays a key regulatory role in the expression of multiple oocyte-specific genes, including those that initiate folliculogenesis and those that encode the zona pellucida (ZP1, ZP2 and ZP3) required for fertilization and early embryonic survival. Essential for oocytes to survive and form primordial follicles. The persistence of FIGLA in adult females suggests that it may regulate additional pathways that are essential for normal ovarian development. Binds to the E [...] 
67	ID1	9606.ENSP00000365280	ID1	DNA-binding protein inhibitor ID-1; Transcriptional regulator (lacking a basic DNA binding domain) which negatively regulates the basic helix-loop-helix (bHLH) transcription factors by forming heterodimers and inhibiting their DNA binding and transcriptional activity. Implicated in regulating a variety of cellular processes, including cellular growth, senescence, differentiation, apoptosis, angiogenesis, and neoplastic transformation. Inhibits skeletal muscle and cardiac myocyte differentiation. Regulates the circadian clock by repressing the transcriptional activator activity of the C [...] 
68	ID4	9606.ENSP00000367972	ID4	DNA-binding protein inhibitor ID-4; Transcriptional regulator (lacking a basic DNA binding domain) which negatively regulates the basic helix-loop-helix (bHLH) transcription factors by forming heterodimers and inhibiting their DNA binding and transcriptional activity. Implicated in regulating a variety of cellular processes, including cellular growth, senescence, differentiation, apoptosis, angiogenesis, and neoplastic transformation (By similarity).
69	ID3	9606.ENSP00000363689	ID3	DNA-binding protein inhibitor ID-3; Transcriptional regulator (lacking a basic DNA binding domain) which negatively regulates the basic helix-loop-helix (bHLH) transcription factors by forming heterodimers and inhibiting their DNA binding and transcriptional activity. Implicated in regulating a variety of cellular processes, including cellular growth, senescence, differentiation, apoptosis, angiogenesis, and neoplastic transformation. Involved in myogenesis by inhibiting skeletal muscle and cardiac myocyte differentiation and promoting muscle precursor cells proliferation. Inhibits the [...] 
70	ID2	9606.ENSP00000234091	ID2	DNA-binding protein inhibitor ID-2; Transcriptional regulator (lacking a basic DNA binding domain) which negatively regulates the basic helix-loop-helix (bHLH) transcription factors by forming heterodimers and inhibiting their DNA binding and transcriptional activity. Implicated in regulating a variety of cellular processes, including cellular growth, senescence, differentiation, apoptosis, angiogenesis, and neoplastic transformation. Inhibits skeletal muscle and cardiac myocyte differentiation. Regulates the circadian clock by repressing the transcriptional activator activity of the C [...] 
71	ASCL2	9606.ENSP00000332293	ASCL2	Achaete-scute homolog 2; AS-C proteins are involved in the determination of the neuronal precursors in the peripheral nervous system and the central nervous system.
72	ASCL1	9606.ENSP00000266744	ASCL1	Achaete-scute homolog 1; Transcription factor that plays a key role in neuronal differentiation: acts as a pioneer transcription factor, accessing closed chromatin to allow other factors to bind and activate neural pathways. Directly binds the E box motif (5'-CANNTG-3') on promoters and promotes transcription of neuronal genes. The combination of three transcription factors, ASCL1, POU3F2/BRN2 and MYT1L, is sufficient to reprogram fibroblasts and other somatic cells into induced neuronal (iN) cells in vitro. Plays a role at early stages of development of specific neural lineages in mos [...] 
73	ASCL4	9606.ENSP00000345420	ASCL4	Achaete-scute homolog 4; Could be a transcriptional regulator involved in skin development.
74	ASCL5	9606.ENSP00000472681	ASCL5	Achaete-scute homolog 5; Achaete-scute family bHLH transcription factor 5.
75	ASCL3	9606.ENSP00000435770	ASCL3	Achaete-scute homolog 3; Transcriptional repressor. Inhibits myogenesis (By similarity).
76	TAL1	9606.ENSP00000294339	TAL1	T-cell acute lymphocytic leukemia protein 1; Implicated in the genesis of hemopoietic malignancies. It may play an important role in hemopoietic differentiation. Serves as a positive regulator of erythroid differentiation (By similarity).
77	LYL1	9606.ENSP00000264824	LYL1	Protein lyl-1; LYL1 basic helix-loop-helix family member.
78	TAL2	9606.ENSP00000334547	TAL2	T-cell acute lymphocytic leukemia protein 2; TAL bHLH transcription factor 2.
79	NHLH2	9606.ENSP00000358519	NHLH2	Helix-loop-helix protein 2; May serve as DNA-binding protein and may be involved in the control of cell-type determination, possibly within the developing nervous system.
80	NHLH1	9606.ENSP00000302189	NHLH1	Helix-loop-helix protein 1; May serve as DNA-binding protein and may be involved in the control of cell-type determination, possibly within the developing nervous system.
81	MESP2	9606.ENSP00000342392	MESP2	Mesoderm posterior protein 2; Transcription factor with important role in somitogenesis. Defines the rostrocaudal patterning of the somite by participating in distinct Notch pathways. Regulates also the FGF signaling pathway. Specifies the rostral half of the somites. Generates rostro-caudal polarity of somites by down-regulating in the presumptive rostral domain DLL1, a Notch ligand. Participates in the segment border formation by activating in the anterior presomitic mesoderm LFNG, a negative regulator of DLL1-Notch signaling. Acts as a strong suppressor of Notch activity. Together w [...] 
82	MSGN1	9606.ENSP00000281047	MSGN1	Mesogenin-1; Involved in specifying the paraxial, but not dorsal, mesoderm. May regulate the expression of T-box transcription factors required for mesoderm formation and differentiation (By similarity).
83	MESP1	9606.ENSP00000300057	MESP1	Mesoderm posterior protein 1; Transcription factor. Plays a role in the epithelialization of somitic mesoderm and in the development of cardiac mesoderm. Defines the rostrocaudal patterning of the somites by participating in distinct Notch pathways (By similarity).
84	PTF1A	9606.ENSP00000365687	PTF1A	Pancreas transcription factor 1 subunit alpha; Transcription factor implicated in the cell fate determination in various organs. Binds to the E-box consensus sequence 5'-CANNTG-3'. Plays a role in early and late pancreas development and differentiation. Important for determining whether cells allocated to the pancreatic buds continue towards pancreatic organogenesis or revert back to duodenal fates. May be involved in the maintenance of exocrine pancreas-specific gene expression including ELA1 and amylase. Required for the formation of pancreatic acinar and ductal cells. Plays an impor [...] 
85	FERD3L	9606.ENSP00000275461	FERD3L	Fer3-like protein; Transcription factor that binds to the E-box and functions as inhibitor of transcription. DNA binding requires dimerization with an E protein. Inhibits transcription activation by ASCL1/MASH1 by sequestering E proteins (By similarity).
86	ATOH7	9606.ENSP00000362777	ATOH7	Protein atonal homolog 7; Transcription factor involved in the differentiation of retinal ganglion cells.
87	ATOH1	9606.ENSP00000302216	ATOH1	Protein atonal homolog 1; Transcriptional regulator. Activates E box-dependent transcription in collaboration with TCF3/E47, but the activity is completely antagonized by the negative regulator of neurogenesis HES1. Plays a role in the differentiation of subsets of neural cells by activating E box-dependent transcription (By similarity).
88	BHLHA9	9606.ENSP00000375248	BHLHA9	Class A basic helix-loop-helix protein 9; Transcription factor, which play a role in limb development. Is an essential player in the regulatory network governing transcription of genes implicated in limb morphogenesis.
89	BHLHA15	9606.ENSP00000476312	BHLHA15	Class A basic helix-loop-helix protein 15; Plays a role in controlling the transcriptional activity of MYOD1, ensuring that expanding myoblast populations remain undifferentiated. Repression may occur through muscle-specific E-box occupancy by homodimers. May also negatively regulate bHLH-mediated transcription through an N-terminal repressor domain. Serves as a key regulator of acinar cell function, stability, and identity. Also required for normal organelle localization in exocrine cells and for mitochondrial calcium ion transport. May function as a unique regulator of gene expressio [...] 
90	BHLHE23	9606.ENSP00000480998	BHLHE23	Class E basic helix-loop-helix protein 23; May function as transcriptional repressor. May modulate the expression of genes required for the differentiation and/or maintenance of pancreatic and neuronal cell types. May be important for rod bipolar cell maturation (By similarity).
91	BHLHE22	9606.ENSP00000318799	BHLHE22	Class E basic helix-loop-helix protein 22; Inhibits DNA binding of TCF3/E47 homodimers and TCF3 (E47)/NEUROD1 heterodimers and acts as a strong repressor of Neurod1 and Myod-responsive genes, probably by heterodimerization with class a basic helix-loop-helix factors. Despite the presence of an intact basic domain, does not bind to DNA (By similarity). In the brain, may function as an area-specific transcription factor that regulates the postmitotic acquisition of area identities and elucidate the genetic hierarchy between progenitors and postmitotic neurons driving neocortical arealiza [...] 
92	OLIG1	9606.ENSP00000371785	OLIG1	Oligodendrocyte transcription factor 1; Promotes formation and maturation of oligodendrocytes, especially within the brain. Cooperates with OLIG2 to establish the pMN domain of the embryonic neural tube (By similarity).
93	OLIG3	9606.ENSP00000356708	OLIG3	Oligodendrocyte transcription factor 3; May determine the distinct specification program of class A neurons in the dorsal part of the spinal cord and suppress specification of class B neurons.
94	OLIG2	9606.ENSP00000331040	OLIG2	Oligodendrocyte transcription factor 2; Required for oligodendrocyte and motor neuron specification in the spinal cord, as well as for the development of somatic motor neurons in the hindbrain. Functions together with ZNF488 to promote oligodendrocyte differentiation. Cooperates with OLIG1 to establish the pMN domain of the embryonic neural tube. Antagonist of V2 interneuron and of NKX2-2-induced V3 interneuron development.
95	NEUROG2	9606.ENSP00000317333	NEUROG2	Neurogenin-2; Transcriptional regulator. Involved in neuronal differentiation. Activates transcription by binding to the E box (5'- CANNTG-3').
96	NEUROG3	9606.ENSP00000242462	NEUROG3	Neurogenin-3; Acts as a transcriptional regulator. Together with NKX2-2, initiates transcriptional activation of NEUROD1. Involved in neurogenesis. Also required for the specification of a common precursor of the 4 pancreatic endocrine cell types (By similarity).
97	NEUROG1	9606.ENSP00000317580	NEUROG1	Neurogenin-1; Acts as a transcriptional regulator. Involved in the initiation of neuronal differentiation. Activates transcription by binding to the E box (5'-CANNTG-3'). Associates with chromatin to enhancer regulatory elements in genes encoding key transcriptional regulators of neurogenesis (By similarity).
98	NEUROD2	9606.ENSP00000306754	NEUROD2	Neurogenic differentiation factor 2; Transcriptional regulator implicated in neuronal determination. Mediates calcium-dependent transcription activation by binding to E box-containing promoter. Critical factor essential for the repression of the genetic program for neuronal differentiation; prevents the formation of synaptic vesicle clustering at active zone to the presynaptic membrane in postmitotic neurons. Induces transcription of ZEB1, which in turn represses neuronal differentiation by down- regulating REST expression. Plays a role in the establishment and maturation of thalamocor [...] 
99	NEUROD6	9606.ENSP00000297142	NEUROD6	Neurogenic differentiation factor 6; Activates E box-dependent transcription in collaboration with TCF3/E47. May be a trans-acting factor involved in the development and maintenance of the mammalian nervous system. Transactivates the promoter of its own gene (By similarity).
100	NEUROD4	9606.ENSP00000242994	NEUROD4	Neurogenic differentiation factor 4; Probably acts as a transcriptional activator. Mediates neuronal differentiation. Required for the regulation of amacrine cell fate specification in the retina (By similarity).
101	NEUROD1	9606.ENSP00000295108	NEUROD1	Neurogenic differentiation factor 1; Acts as a transcriptional activator: mediates transcriptional activation by binding to E box-containing promoter consensus core sequences 5'-CANNTG-3'. Associates with the p300/CBP transcription coactivator complex to stimulate transcription of the secretin gene as well as the gene encoding the cyclin-dependent kinase inhibitor CDKN1A. Contributes to the regulation of several cell differentiation pathways, like those that promote the formation of early retinal ganglion cells, inner ear sensory neurons, granule cells forming either the cerebellum or  [...] 
102	TCF21	9606.ENSP00000356857	TCF21	Transcription factor 21; Involved in epithelial-mesenchymal interactions in kidney and lung morphogenesis that include epithelial differentiation and branching morphogenesis. May play a role in the specification or differentiation of one or more subsets of epicardial cell types.
103	MSC	9606.ENSP00000321445	MSC	Musculin; Transcription repressor capable of inhibiting the transactivation capability of TCF3/E47. May play a role in regulating antigen-dependent B-cell differentiation.
104	TCF24	9606.ENSP00000455444	TCF24	Transcription factor 24; Putative transcription factor.
105	TCF23	9606.ENSP00000296096	TCF23	Transcription factor 23; Inhibits E-box-mediated binding and transactivation of bHLH factors. Inhibitory effect is similar to that of ID proteins. Inhibits the formation of TCF3 and MYOD1 homodimers and heterodimers. Lacks DNA binding activity. Seems to play a role in the inhibition of myogenesis (By similarity).
106	TWIST2	9606.ENSP00000482581	TWIST2	Twist-related protein 2; Binds to the E-box consensus sequence 5'-CANNTG-3' as a heterodimer and inhibits transcriptional activation by MYOD1, MYOG, MEF2A and MEF2C. Also represses expression of proinflammatory cytokines such as TNFA and IL1B. Involved in postnatal glycogen storage and energy metabolism (By similarity). Inhibits the premature or ectopic differentiation of preosteoblast cells during osteogenesis, possibly by changing the internal signal transduction response of osteoblasts to external growth factors.
107	TWIST1	9606.ENSP00000242261	TWIST1	Twist-related protein 1; Acts as a transcriptional regulator. Inhibits myogenesis by sequestrating E proteins, inhibiting trans-activation by MEF2, and inhibiting DNA-binding by MYOD1 through physical interaction. This interaction probably involves the basic domains of both proteins. Also represses expression of proinflammatory cytokines such as TNFA and IL1B. Regulates cranial suture patterning and fusion. Activates transcription as a heterodimer with E proteins. Regulates gene expression differentially, depending on dimer composition. Homodimers induce expression of FGFR2 and POSTN w [...] 
108	HAND2	9606.ENSP00000352565	HAND2	Heart- and neural crest derivatives-expressed protein 2; Essential for cardiac morphogenesis, particularly for the formation of the right ventricle and of the aortic arch arteries. Required for vascular development and regulation of angiogenesis, possibly through a VEGF signaling pathway. Plays also an important role in limb development, particularly in the establishment of anterior- posterior polarization, acting as an upstream regulator of sonic hedgehog (SHH) induction in the limb bud. Is involved in the development of branchial arches, which give rise to unique structures in the he [...] 
109	HAND1	9606.ENSP00000231121	HAND1	Heart- and neural crest derivatives-expressed protein 1; Transcription factor that plays an essential role in both trophoblast giant cell differentiation and in cardiac morphogenesis (By similarity). Binds the DNA sequence 5'-NRTCTG-3' (non-canonical E-box) (By similarity). Acts as a transcriptional repressor of SOX15 (By similarity). In the adult, could be required for ongoing expression of cardiac-specific genes.
110	TCF15	9606.ENSP00000246080	TCF15	Transcription factor 15; May function as an early transcriptional regulator, involved in the patterning of the mesoderm and in lineage determination of cell types derived from the mesoderm.
111	SCX	9606.ENSP00000476384	SCX	Basic helix-loop-helix transcription factor scleraxis; Plays an early essential role in mesoderm formation, as well as a later role in formation of somite-derived chondrogenic lineages.
