#queryIndex	queryItem	stringId	preferredName	annotation
1	TFAP4	9606.ENSP00000204517	TFAP4	Transcription factor AP-4; Transcription factor that activates both viral and cellular genes by binding to the symmetrical DNA sequence 5'-CAGCTG-3'.
2	MLX	9606.ENSP00000246912	MLX	Max-like protein X; Transcription regulator. Forms a sequence-specific DNA- binding protein complex with MAD1, MAD4, MNT, WBSCR14 and MLXIP which recognizes the core sequence 5'-CACGTG-3'. The TCFL4-MAD1, TCFL4-MAD4, TCFL4-WBSCR14 complexes are transcriptional repressors. Plays a role in transcriptional activation of glycolytic target genes. Involved in glucose-responsive gene regulation.
3	MLXIPL	9606.ENSP00000320886	MLXIPL	Carbohydrate-responsive element-binding protein; Transcriptional repressor. Binds to the canonical and non- canonical E box sequences 5'-CACGTG-3' (By similarity).
4	MLXIP	9606.ENSP00000312834	MLXIP	MLX-interacting protein; Binds DNA as a heterodimer with MLX and activates transcription. Binds to the canonical E box sequence 5'-CACGTG-3'. Plays a role in transcriptional activation of glycolytic target genes. Involved in glucose-responsive gene regulation.
5	TCFL5	9606.ENSP00000334294	TCFL5	Transcription factor-like 5 protein; Putative transcription factor. Isoform 3 may play a role in early spermatogenesis.
6	SOHLH1	9606.ENSP00000404438	SOHLH1	Spermatogenesis- and oogenesis-specific basic helix-loop-helix-containing protein 1; Transcription regulator of both male and female germline differentiation. Suppresses genes involved in spermatogonial stem cells maintenance, and induces genes important for spermatogonial differentiation. Coordinates oocyte differentiation without affecting meiosis I (By similarity).
7	SOHLH2	9606.ENSP00000369210	SOHLH2	Spermatogenesis- and oogenesis-specific basic helix-loop-helix-containing protein 2; Transcription regulator of both male and female germline differentiation. Suppresses genes involved in spermatogonial stem cells maintenance, and induces genes important for spermatogonial differentiation. Coordinates oocyte differentiation without affecting meiosis I (By similarity).
8	MYC	9606.ENSP00000478887	MYC	Myc proto-oncogene protein; Transcription factor that binds DNA in a non-specific manner, yet also specifically recognizes the core sequence 5'-CAC[GA]TG-3'. Activates the transcription of growth-related genes. Binds to the VEGFA promoter, promoting VEGFA production and subsequent sprouting angiogenesis. Regulator of somatic reprogramming, controls self-renewal of embryonic stem cells. Functions with TAF6L to activate target gene expression through RNA polymerase II pause release (By similarity).
9	MYCN	9606.ENSP00000281043	MYCN	N-myc proto-oncogene protein; Positively regulates the transcription of MYCNOS in neuroblastoma cells.
10	MYCL	9606.ENSP00000380494	MYCL	Protein L-Myc; MYCL proto-oncogene, bHLH transcription factor.
11	MAX	9606.ENSP00000351490	MAX	Protein max; Transcription regulator. Forms a sequence-specific DNA- binding protein complex with MYC or MAD which recognizes the core sequence 5'-CAC[GA]TG-3'. The MYC:MAX complex is a transcriptional activator, whereas the MAD:MAX complex is a repressor. May repress transcription via the recruitment of a chromatin remodeling complex containing H3 'Lys-9' histone methyltransferase activity. Represses MYC transcriptional activity from E-box elements.
12	MNT	9606.ENSP00000174618	MNT	Max-binding protein MNT; Binds DNA as a heterodimer with MAX and represses transcription. Binds to the canonical E box sequence 5'-CACGTG-3' and, with higher affinity, to 5'-CACGCG-3'.
13	MXD3	9606.ENSP00000401867	MXD3	Max dimerization protein 3; Transcriptional repressor. Binds with MAX to form a sequence- specific DNA-binding protein complex which recognizes the core sequence 5'-CAC[GA]TG-3'. Antagonizes MYC transcriptional activity by competing for MAX and suppresses MYC dependent cell transformation (By similarity).
14	MXD4	9606.ENSP00000337889	MXD4	Max dimerization protein 4; Transcriptional repressor. Binds with MAX to form a sequence- specific DNA-binding protein complex which recognizes the core sequence 5'-CAC[GA]TG-3'. Antagonizes MYC transcriptional activity by competing for MAX and suppresses MYC dependent cell transformation (By similarity).
15	MXI1	9606.ENSP00000331152	MXI1	Max-interacting protein 1; Transcriptional repressor. MXI1 binds with MAX to form a sequence-specific DNA-binding protein complex which recognizes the core sequence 5'-CAC[GA]TG-3'. MXI1 thus antagonizes MYC transcriptional activity by competing for MAX.
16	MXD1	9606.ENSP00000264444	MXD1	Max dimerization protein 1; Transcriptional repressor. MAD binds with MAX to form a sequence-specific DNA-binding protein complex which recognizes the core sequence 5'-CAC[GA]TG-3'. MAD thus antagonizes MYC transcriptional activity by competing for MAX.
17	SREBF2	9606.ENSP00000354476	SREBF2	Processed sterol regulatory element-binding protein 2; Transcriptional activator required for lipid homeostasis. Regulates transcription of the LDL receptor gene as well as the cholesterol and to a lesser degree the fatty acid synthesis pathway (By similarity). Binds the sterol regulatory element 1 (SRE-1) (5'- ATCACCCCAC-3') found in the flanking region of the LDRL and HMG-CoA synthase genes.
18	SREBF1	9606.ENSP00000348069	SREBF1	Processed sterol regulatory element-binding protein 1; Transcriptional activator required for lipid homeostasis. Regulates transcription of the LDL receptor gene as well as the fatty acid and to a lesser degree the cholesterol synthesis pathway (By similarity). Binds to the sterol regulatory element 1 (SRE-1) (5'- ATCACCCCAC-3'). Has dual sequence specificity binding to both an E-box motif (5'-ATCACGTGA-3') and to SRE-1 (5'-ATCACCCCAC-3').
19	MITF	9606.ENSP00000391803	MITF	Microphthalmia-associated transcription factor; Transcription factor that regulates the expression of genes with essential roles in cell differentiation, proliferation and survival. Binds to M-boxes (5'-TCATGTG-3') and symmetrical DNA sequences (E-boxes) (5'-CACGTG-3') found in the promoters of target genes, such as BCL2 and tyrosinase (TYR). Plays an important role in melanocyte development by regulating the expression of tyrosinase (TYR) and tyrosinase-related protein 1 (TYRP1). Plays a critical role in the differentiation of various cell types, such as neural crest-derived melanocyt [...] 
20	TFE3	9606.ENSP00000314129	TFE3	Transcription factor E3; Transcription factor that specifically recognizes and binds E-box sequences (5'-CANNTG-3') (By similarity). Efficient DNA-binding requires dimerization with itself or with another MiT/TFE family member such as TFEB or MITF (By similarity). In association with TFEB, activates the expression of CD40L in T-cells, thereby playing a role in T-cell-dependent antibody responses in activated CD4(+) T-cells and thymus-dependent humoral immunity (By similarity). Specifically recognizes the MUE3 box, a subset of E-boxes, present in the immunoglobulin enhancer. It also bin [...] 
21	TFEC	9606.ENSP00000265440	TFEC	Transcription factor EC; Transcriptional regulator that acts as a repressor or an activator. Acts as a transcriptional repressor on minimal promoter containing element F (that includes an E-box sequence). Binds to element F in an E-box sequence-specific manner. Acts as a transcriptional transactivator on the proximal promoter region of the tartrate-resistant acid phosphatase (TRAP) E-box containing promoter (By similarity). Collaborates with MITF in target gene activation (By similarity). Acts as a transcriptional repressor on minimal promoter containing mu E3 enhancer sequence (By sim [...] 
22	TFEB	9606.ENSP00000351742	TFEB	Transcription factor EB; Transcription factor that specifically recognizes and binds E-box sequences (5'-CANNTG-3'). Efficient DNA-binding requires dimerization with itself or with another MiT/TFE family member such as TFE3 or MITF. In association with TFE3, activates the expression of CD40L in T-cells, thereby playing a role in T-cell-dependent antibody responses in activated CD4(+) T-cells and thymus-dependent humoral immunity. Specifically recognizes and binds the CLEAR-box sequence (5'- GTCACGTGAC-3') present in the regulatory region of many lysosomal genes, leading to activate the [...] 
23	USF3	9606.ENSP00000320794	USF3	Basic helix-loop-helix domain-containing protein USF3; Involved in the negative regulation of epithelial-mesenchymal transition, the process by which epithelial cells lose their polarity and adhesion properties to become mesenchymal cells with enhanced migration and invasive properties.
24	USF2	9606.ENSP00000222305	USF2	Upstream stimulatory factor 2; Transcription factor that binds to a symmetrical DNA sequence (E-boxes) (5'-CACGTG-3') that is found in a variety of viral and cellular promoters.
25	USF1	9606.ENSP00000357000	USF1	Upstream stimulatory factor 1; Transcription factor that binds to a symmetrical DNA sequence (E-boxes) (5'-CACGTG-3') that is found in a variety of viral and cellular promoters.
26	NCOA1	9606.ENSP00000385216	NCOA1	Nuclear receptor coactivator 1; Nuclear receptor coactivator that directly binds nuclear receptors and stimulates the transcriptional activities in a hormone- dependent fashion. Involved in the coactivation of different nuclear receptors, such as for steroids (PGR, GR and ER), retinoids (RXRs), thyroid hormone (TRs) and prostanoids (PPARs). Also involved in coactivation mediated by STAT3, STAT5A, STAT5B and STAT6 transcription factors. Displays histone acetyltransferase activity toward H3 and H4; the relevance of such activity remains however unclear. Plays a central role in creating m [...] 
27	NCOA2	9606.ENSP00000399968	NCOA2	Nuclear receptor coactivator 2; Transcriptional coactivator for steroid receptors and nuclear receptors. Coactivator of the steroid binding domain (AF-2) but not of the modulating N-terminal domain (AF-1). Required with NCOA1 to control energy balance between white and brown adipose tissues. Critical regulator of glucose metabolism regulation, acts as RORA coactivator to specifically modulate G6PC expression. Involved in the positive regulation of the transcriptional activity of the glucocorticoid receptor NR3C1 by sumoylation enhancer RWDD3. Positively regulates the circadian clock by [...] 
28	NCOA3	9606.ENSP00000361066	NCOA3	Nuclear receptor coactivator 3; Nuclear receptor coactivator that directly binds nuclear receptors and stimulates the transcriptional activities in a hormone- dependent fashion. Plays a central role in creating a multisubunit coactivator complex, which probably acts via remodeling of chromatin. Involved in the coactivation of different nuclear receptors, such as for steroids (GR and ER), retinoids (RARs and RXRs), thyroid hormone (TRs), vitamin D3 (VDR) and prostanoids (PPARs). Displays histone acetyltransferase activity. Also involved in the coactivation of the NF-kappa-B pathway via  [...] 
29	NPAS2	9606.ENSP00000338283	NPAS2	Neuronal PAS domain-containing protein 2; Transcriptional activator which forms a core component of the circadian clock. The circadian clock, an internal time-keeping system, regulates various physiological processes through the generation of approximately 24 hour circadian rhythms in gene expression, which are translated into rhythms in metabolism and behavior. It is derived from the Latin roots 'circa' (about) and 'diem' (day) and acts as an important regulator of a wide array of physiological functions including metabolism, sleep, body temperature, blood pressure, endocrine, immune, [...] 
30	CLOCK	9606.ENSP00000426983	CLOCK	Circadian locomoter output cycles protein kaput; Transcriptional activator which forms a core component of the circadian clock. The circadian clock, an internal time-keeping system, regulates various physiological processes through the generation of approximately 24 hour circadian rhythms in gene expression, which are translated into rhythms in metabolism and behavior. It is derived from the Latin roots 'circa' (about) and 'diem' (day) and acts as an important regulator of a wide array of physiological functions including metabolism, sleep, body temperature, blood pressure, endocrine,  [...] 
31	ARNTL2	9606.ENSP00000266503	ARNTL2	Aryl hydrocarbon receptor nuclear translocator-like protein 2; Transcriptional activator which forms a core component of the circadian clock. The circadian clock, an internal time-keeping system, regulates various physiological processes through the generation of approximately 24 hour circadian rhythms in gene expression, which are translated into rhythms in metabolism and behavior. It is derived from the Latin roots 'circa' (about) and 'diem' (day) and acts as an important regulator of a wide array of physiological functions including metabolism, sleep, body temperature, blood pressur [...] 
32	ARNTL	9606.ENSP00000384517	ARNTL	Aryl hydrocarbon receptor nuclear translocator-like protein 1; Transcriptional activator which forms a core component of the circadian clock. The circadian clock, an internal time-keeping system, regulates various physiological processes through the generation of approximately 24 hour circadian rhythms in gene expression, which are translated into rhythms in metabolism and behavior. It is derived from the Latin roots 'circa' (about) and 'diem' (day) and acts as an important regulator of a wide array of physiological functions including metabolism, sleep, body temperature, blood pressur [...] 
33	ARNT2	9606.ENSP00000307479	ARNT2	Aryl hydrocarbon receptor nuclear translocator 2; Transcription factor that plays a role in the development of the hypothalamo-pituitary axis, postnatal brain growth, and visual and renal function. Specifically recognizes the xenobiotic response element (XRE).
34	ARNT	9606.ENSP00000351407	ARNT	Aryl hydrocarbon receptor nuclear translocator; Required for activity of the Ah (dioxin) receptor. This protein is required for the ligand-binding subunit to translocate from the cytosol to the nucleus after ligand binding. The complex then initiates transcription of genes involved in the activation of PAH procarcinogens. The heterodimer binds to core DNA sequence 5'-TACGTG-3' within the hypoxia response element (HRE) of target gene promoters and functions as a transcriptional regulator of the adaptive response to hypoxia (By similarity). The heterodimer ARNT:AHR binds to core DNA sequ [...] 
35	NPAS4	9606.ENSP00000311196	NPAS4	Neuronal PAS domain-containing protein 4; Transcription factor expressed in neurons of the brain that regulates the excitatory-inhibitory balance within neural circuits and is required for contextual memory in the hyppocampus (By similarity). Plays a key role in the structural and functional plasticity of neurons (By similarity). Acts as an early-response transcription factor in both excitatory and inhibitory neurons, where it induces distinct but overlapping sets of late-response genes in these two types of neurons, allowing the synapses that form on inhibitory and excitatory neurons  [...] 
36	AHRR	9606.ENSP00000323816	AHRR	Aryl hydrocarbon receptor repressor; Mediates dioxin toxicity and is involved in regulation of cell growth and differentiation. Represses the transcription activity of AHR by competing with this transcription factor for heterodimer formation with the ARNT and subsequently binding to the xenobiotic response element (XRE) sequence present in the promoter regulatory region of variety of genes. Represses CYP1A1 by binding the XRE sequence and recruiting ANKRA2, HDAC4 and/or HDAC5. Autoregulates its expression by associating with its own XRE site.
37	AHR	9606.ENSP00000242057	AHR	Aryl hydrocarbon receptor; Ligand-activated transcriptional activator. Binds to the XRE promoter region of genes it activates. Activates the expression of multiple phase I and II xenobiotic chemical metabolizing enzyme genes (such as the CYP1A1 gene). Mediates biochemical and toxic effects of halogenated aromatic hydrocarbons. Involved in cell-cycle regulation. Likely to play an important role in the development and maturation of many tissues. Regulates the circadian clock by inhibiting the basal and circadian expression of the core circadian component PER1. Inhibits PER1 by repressing [...] 
38	SIM2	9606.ENSP00000290399	SIM2	Single-minded homolog 2; Transcription factor that may be a master gene of CNS development in cooperation with Arnt. It may have pleiotropic effects in the tissues expressed during development.
39	SIM1	9606.ENSP00000358210	SIM1	Single-minded homolog 1; Transcriptional factor that may have pleiotropic effects during embryogenesis and in the adult.
40	NPAS3	9606.ENSP00000348460	NPAS3	Neuronal PAS domain-containing protein 3; May play a broad role in neurogenesis. May control regulatory pathways relevant to schizophrenia and to psychotic illness (By similarity).
41	NPAS1	9606.ENSP00000469142	NPAS1	Neuronal PAS domain-containing protein 1; May control regulatory pathways relevant to schizophrenia and to psychotic illness. May play a role in late central nervous system development by modulating EPO expression in response to cellular oxygen level (By similarity). Forms a heterodimer that binds core DNA sequence 5'-TACGTG-3' within the hypoxia response element (HRE) leading to transcriptional repression on its target gene TH (By similarity).
42	HIF1A	9606.ENSP00000437955	HIF1A	Hypoxia-inducible factor 1-alpha; Functions as a master transcriptional regulator of the adaptive response to hypoxia. Under hypoxic conditions, activates the transcription of over 40 genes, including erythropoietin, glucose transporters, glycolytic enzymes, vascular endothelial growth factor, HILPDA, and other genes whose protein products increase oxygen delivery or facilitate metabolic adaptation to hypoxia. Plays an essential role in embryonic vascularization, tumor angiogenesis and pathophysiology of ischemic disease. Heterodimerizes with ARNT; heterodimer binds to core DNA sequenc [...] 
43	HIF3A	9606.ENSP00000366898	HIF3A	Hypoxia-inducible factor 3-alpha; Acts as a transcriptional regulator in adaptive response to low oxygen tension. Acts as a regulator of hypoxia-inducible gene expression. Functions as an inhibitor of angiogenesis in hypoxic cells of the cornea. Plays a role in the development of the cardiorespiratory system. May also be involved in apoptosis (By similarity). [Isoform 3]: Attenuates the ability of transcription factor HIF1A to bind to hypoxia-responsive elements (HRE) located within the enhancer/promoter of hypoxia-inducible target genes and hence inhibits HRE-driven transcriptional ac [...] 
44	EPAS1	9606.ENSP00000263734	EPAS1	Endothelial PAS domain-containing protein 1; Transcription factor involved in the induction of oxygen regulated genes. Heterodimerizes with ARNT; heterodimer binds to core DNA sequence 5'-TACGTG-3' within the hypoxia response element (HRE) of target gene promoters (By similarity). Regulates the vascular endothelial growth factor (VEGF) expression and seems to be implicated in the development of blood vessels and the tubular system of lung. May also play a role in the formation of the endothelium that gives rise to the blood brain barrier. Potent activator of the Tie-2 tyrosine kinase e [...] 
45	HELT	9606.ENSP00000426033	HELT	Hairy and enhancer of split-related protein HELT; Transcriptional repressor which binds preferentially to the canonical E box sequence 5'-CACGCG-3'; Belongs to the HEY family.
46	BHLHE41	9606.ENSP00000242728	BHLHE41	Class E basic helix-loop-helix protein 41; Transcriptional repressor involved in the regulation of the circadian rhythm by negatively regulating the activity of the clock genes and clock-controlled genes. Acts as the negative limb of a novel autoregulatory feedback loop (DEC loop) which differs from the one formed by the PER and CRY transcriptional repressors (PER/CRY loop). Both these loops are interlocked as it represses the expression of PER1 and in turn is repressed by PER1/2 and CRY1/2. Represses the activity of the circadian transcriptional activator: CLOCK-ARNTL/BMAL1 heterodime [...] 
47	BHLHE40	9606.ENSP00000256495	BHLHE40	Class E basic helix-loop-helix protein 40; Transcriptional repressor involved in the regulation of the circadian rhythm by negatively regulating the activity of the clock genes and clock-controlled genes. Acts as the negative limb of a novel autoregulatory feedback loop (DEC loop) which differs from the one formed by the PER and CRY transcriptional repressors (PER/CRY loop). Both these loops are interlocked as it represses the expression of PER1/2 and in turn is repressed by PER1/2 and CRY1/2. Represses the activity of the circadian transcriptional activator: CLOCK- ARNTL/BMAL1|ARNTL2/ [...] 
48	HEYL	9606.ENSP00000361943	HEYL	Hairy/enhancer-of-split related with YRPW motif-like protein; Downstream effector of Notch signaling which may be required for cardiovascular development (By similarity). Transcriptional repressor which binds preferentially to the canonical E box sequence 5'-CACGTG-3' (By similarity). Represses transcription by the cardiac transcriptional activators GATA4 and GATA6.
49	HEY2	9606.ENSP00000357348	HEY2	Hairy/enhancer-of-split related with YRPW motif protein 2; Downstream effector of Notch signaling which may be required for cardiovascular development. Transcriptional repressor which binds preferentially to the canonical E box sequence 5'-CACGTG-3'. Represses transcription by the cardiac transcriptional activators GATA4 and GATA6; Belongs to the HEY family.
50	HEY1	9606.ENSP00000338272	HEY1	Hairy/enhancer-of-split related with YRPW motif protein 1; Transcriptional repressor which binds preferentially to the canonical E box sequence 5'-CACGTG-3'. Downstream effector of Notch signaling required for cardiovascular development. Specifically required for the Notch-induced endocardial epithelial to mesenchymal transition, which is itself criticial for cardiac valve and septum development. May be required in conjunction with HEY2 to specify arterial cell fate or identity. Promotes maintenance of neuronal precursor cells and glial versus neuronal fate specification. Represses tra [...] 
51	HES7	9606.ENSP00000446205	HES7	Transcription factor HES-7; Transcriptional repressor. Represses transcription from both N box- and E box-containing promoters. May with HES1, cooperatively regulate somite formation in the presomitic mesoderm (PSM). May function as a segmentation clock, which is essential for coordinated somite segmentation (By similarity).
52	HES6	9606.ENSP00000272937	HES6	Transcription cofactor HES-6; Does not bind DNA itself but suppresses both HES1-mediated N box-dependent transcriptional repression and binding of HES1 to E box sequences. Also suppresses HES1-mediated inhibition of the heterodimer formed by ASCL1/MASH1 and TCF3/E47, allowing ASCL1 and TCF3 to up- regulate transcription in its presence. Promotes cell differentiation (By similarity).
53	HES5	9606.ENSP00000367714	HES5	Transcription factor HES-5; Transcriptional repressor of genes that require a bHLH protein for their transcription. Plays an important role as neurogenesis negative regulator (By similarity).
54	HES3	9606.ENSP00000367130	HES3	Transcription factor HES-3; Transcriptional repressor of genes that require a bHLH protein for their transcription.
55	HES2	9606.ENSP00000367065	HES2	Transcription factor HES-2; Transcriptional repressor of genes that require a bHLH protein for their transcription.
56	HES4	9606.ENSP00000393198	HES4	Transcription factor HES-4; Transcriptional repressor. Binds DNA on N-box motifs: 5'- CACNAG-3' (By similarity).
57	HES1	9606.ENSP00000232424	HES1	Transcription factor HES-1; Transcriptional repressor of genes that require a bHLH protein for their transcription. May act as a negative regulator of myogenesis by inhibiting the functions of MYOD1 and ASH1. Binds DNA on N-box motifs: 5'-CACNAG-3' with high affinity and on E-box motifs: 5'- CANNTG-3' with low affinity (By similarity). May play a role in a functional FA core complex response to DNA cross-link damage, being required for the stability and nuclear localization of FA core complex proteins, as well as for FANCD2 monoubiquitination in response to DNA damage.
58	ATOH8	9606.ENSP00000304676	ATOH8	Protein atonal homolog 8; Transcription factor that binds a palindromic (canonical) core consensus DNA sequence 5'-CANNTG- 3' known as an E-box element, possibly as a heterodimer with other bHLH proteins. Regulates endothelial cell proliferation, migration and tube-like structures formation. Modulates endothelial cell differentiation through NOS3. May be implicated in specification and differentiation of neuronal cell lineages in the brain (By similarity). May participate in kidney development and may be involved in podocyte differentiation (By similarity). During early embryonic devel [...] 
59	TCF4	9606.ENSP00000381382	TCF4	Transcription factor 4; Transcription factor that binds to the immunoglobulin enhancer Mu-E5/KE5-motif. Involved in the initiation of neuronal differentiation. Activates transcription by binding to the E box (5'- CANNTG-3'). Binds to the E-box present in the somatostatin receptor 2 initiator element (SSTR2-INR) to activate transcription (By similarity). Preferentially binds to either 5'-ACANNTGT-3' or 5'- CCANNTGG-3'.
60	TCF3	9606.ENSP00000262965	TCF3	Transcription factor E2-alpha; Transcriptional regulator. Involved in the initiation of neuronal differentiation. Heterodimers between TCF3 and tissue-specific basic helix-loop-helix (bHLH) proteins play major roles in determining tissue-specific cell fate during embryogenesis, like muscle or early B- cell differentiation. Dimers bind DNA on E-box motifs: 5'-CANNTG-3'. Binds to the kappa-E2 site in the kappa immunoglobulin gene enhancer. Binds to IEB1 and IEB2, which are short DNA sequences in the insulin gene transcription control region.
